# simple case showing partitions added in INSERT
set timestamp= unix_timestamp('2026-05-02 00:00:00');
create table t1 (c datetime) engine=innodb
PARTITION BY RANGE COLUMNS (c)
INTERVAL 1 Day
(
PARTITION p0 VALUES LESS THAN ('2026-04-20')
);
show create table t1;
Table	Create Table
t1	CREATE TABLE `t1` (
  `c` datetime DEFAULT NULL
) ENGINE=InnoDB DEFAULT CHARSET=utf8mb4 COLLATE=utf8mb4_uca1400_ai_ci
 PARTITION BY RANGE  COLUMNS(`c`)INTERVAL 1 DAY
(PARTITION `p0` VALUES LESS THAN ('2026-04-20') ENGINE = InnoDB)
insert into t1 values ('2026-05-01');
select * from t1;
c
2026-05-01 00:00:00
show create table t1;
Table	Create Table
t1	CREATE TABLE `t1` (
  `c` datetime DEFAULT NULL
) ENGINE=InnoDB DEFAULT CHARSET=utf8mb4 COLLATE=utf8mb4_uca1400_ai_ci
 PARTITION BY RANGE  COLUMNS(`c`)INTERVAL 1 DAY
(PARTITION `p0` VALUES LESS THAN ('2026-04-20') ENGINE = InnoDB,
 PARTITION `p1` VALUES LESS THAN ('2026-04-21 00:00:00') ENGINE = InnoDB,
 PARTITION `p2` VALUES LESS THAN ('2026-04-22 00:00:00') ENGINE = InnoDB,
 PARTITION `p3` VALUES LESS THAN ('2026-04-23 00:00:00') ENGINE = InnoDB,
 PARTITION `p4` VALUES LESS THAN ('2026-04-24 00:00:00') ENGINE = InnoDB,
 PARTITION `p5` VALUES LESS THAN ('2026-04-25 00:00:00') ENGINE = InnoDB,
 PARTITION `p6` VALUES LESS THAN ('2026-04-26 00:00:00') ENGINE = InnoDB,
 PARTITION `p7` VALUES LESS THAN ('2026-04-27 00:00:00') ENGINE = InnoDB,
 PARTITION `p8` VALUES LESS THAN ('2026-04-28 00:00:00') ENGINE = InnoDB,
 PARTITION `p9` VALUES LESS THAN ('2026-04-29 00:00:00') ENGINE = InnoDB,
 PARTITION `p10` VALUES LESS THAN ('2026-04-30 00:00:00') ENGINE = InnoDB,
 PARTITION `p11` VALUES LESS THAN ('2026-05-01 00:00:00') ENGINE = InnoDB,
 PARTITION `p12` VALUES LESS THAN ('2026-05-02 00:00:00') ENGINE = InnoDB,
 PARTITION `p13` VALUES LESS THAN ('2026-05-03 00:00:00') ENGINE = InnoDB)
select partition_name, partition_method, partition_expression, partition_description, table_rows from information_schema.partitions where table_name='t1';
partition_name	partition_method	partition_expression	partition_description	table_rows
p0	RANGE COLUMNS	`c`	'2026-04-20'	0
p1	RANGE COLUMNS	`c`	'2026-04-21 00:00:00'	0
p2	RANGE COLUMNS	`c`	'2026-04-22 00:00:00'	0
p3	RANGE COLUMNS	`c`	'2026-04-23 00:00:00'	0
p4	RANGE COLUMNS	`c`	'2026-04-24 00:00:00'	0
p5	RANGE COLUMNS	`c`	'2026-04-25 00:00:00'	0
p6	RANGE COLUMNS	`c`	'2026-04-26 00:00:00'	0
p7	RANGE COLUMNS	`c`	'2026-04-27 00:00:00'	0
p8	RANGE COLUMNS	`c`	'2026-04-28 00:00:00'	0
p9	RANGE COLUMNS	`c`	'2026-04-29 00:00:00'	0
p10	RANGE COLUMNS	`c`	'2026-04-30 00:00:00'	0
p11	RANGE COLUMNS	`c`	'2026-05-01 00:00:00'	0
p12	RANGE COLUMNS	`c`	'2026-05-02 00:00:00'	1
p13	RANGE COLUMNS	`c`	'2026-05-03 00:00:00'	0
set timestamp= unix_timestamp('2026-05-06 00:00:00');
insert into t1 values ('2026-05-04');
select * from t1;
c
2026-05-01 00:00:00
2026-05-04 00:00:00
show create table t1;
Table	Create Table
t1	CREATE TABLE `t1` (
  `c` datetime DEFAULT NULL
) ENGINE=InnoDB DEFAULT CHARSET=utf8mb4 COLLATE=utf8mb4_uca1400_ai_ci
 PARTITION BY RANGE  COLUMNS(`c`)INTERVAL 1 DAY
(PARTITION `p0` VALUES LESS THAN ('2026-04-20') ENGINE = InnoDB,
 PARTITION `p1` VALUES LESS THAN ('2026-04-21 00:00:00') ENGINE = InnoDB,
 PARTITION `p2` VALUES LESS THAN ('2026-04-22 00:00:00') ENGINE = InnoDB,
 PARTITION `p3` VALUES LESS THAN ('2026-04-23 00:00:00') ENGINE = InnoDB,
 PARTITION `p4` VALUES LESS THAN ('2026-04-24 00:00:00') ENGINE = InnoDB,
 PARTITION `p5` VALUES LESS THAN ('2026-04-25 00:00:00') ENGINE = InnoDB,
 PARTITION `p6` VALUES LESS THAN ('2026-04-26 00:00:00') ENGINE = InnoDB,
 PARTITION `p7` VALUES LESS THAN ('2026-04-27 00:00:00') ENGINE = InnoDB,
 PARTITION `p8` VALUES LESS THAN ('2026-04-28 00:00:00') ENGINE = InnoDB,
 PARTITION `p9` VALUES LESS THAN ('2026-04-29 00:00:00') ENGINE = InnoDB,
 PARTITION `p10` VALUES LESS THAN ('2026-04-30 00:00:00') ENGINE = InnoDB,
 PARTITION `p11` VALUES LESS THAN ('2026-05-01 00:00:00') ENGINE = InnoDB,
 PARTITION `p12` VALUES LESS THAN ('2026-05-02 00:00:00') ENGINE = InnoDB,
 PARTITION `p13` VALUES LESS THAN ('2026-05-03 00:00:00') ENGINE = InnoDB,
 PARTITION `p14` VALUES LESS THAN ('2026-05-04 00:00:00') ENGINE = InnoDB,
 PARTITION `p15` VALUES LESS THAN ('2026-05-05 00:00:00') ENGINE = InnoDB,
 PARTITION `p16` VALUES LESS THAN ('2026-05-06 00:00:00') ENGINE = InnoDB,
 PARTITION `p17` VALUES LESS THAN ('2026-05-07 00:00:00') ENGINE = InnoDB)
select partition_name, partition_method, partition_expression, partition_description, table_rows from information_schema.partitions where table_name='t1';
partition_name	partition_method	partition_expression	partition_description	table_rows
p0	RANGE COLUMNS	`c`	'2026-04-20'	0
p1	RANGE COLUMNS	`c`	'2026-04-21 00:00:00'	0
p2	RANGE COLUMNS	`c`	'2026-04-22 00:00:00'	0
p3	RANGE COLUMNS	`c`	'2026-04-23 00:00:00'	0
p4	RANGE COLUMNS	`c`	'2026-04-24 00:00:00'	0
p5	RANGE COLUMNS	`c`	'2026-04-25 00:00:00'	0
p6	RANGE COLUMNS	`c`	'2026-04-26 00:00:00'	0
p7	RANGE COLUMNS	`c`	'2026-04-27 00:00:00'	0
p8	RANGE COLUMNS	`c`	'2026-04-28 00:00:00'	0
p9	RANGE COLUMNS	`c`	'2026-04-29 00:00:00'	0
p10	RANGE COLUMNS	`c`	'2026-04-30 00:00:00'	0
p11	RANGE COLUMNS	`c`	'2026-05-01 00:00:00'	0
p12	RANGE COLUMNS	`c`	'2026-05-02 00:00:00'	1
p13	RANGE COLUMNS	`c`	'2026-05-03 00:00:00'	0
p14	RANGE COLUMNS	`c`	'2026-05-04 00:00:00'	0
p15	RANGE COLUMNS	`c`	'2026-05-05 00:00:00'	1
p16	RANGE COLUMNS	`c`	'2026-05-06 00:00:00'	0
p17	RANGE COLUMNS	`c`	'2026-05-07 00:00:00'	0
drop table t1;
create table t1 (c date) engine=innodb
PARTITION BY RANGE COLUMNS (c)
INTERVAL 1 DAY AUTO
(
PARTITION p0 VALUES LESS THAN ('2026-04-30')
);
show create table t1;
Table	Create Table
t1	CREATE TABLE `t1` (
  `c` date DEFAULT NULL
) ENGINE=InnoDB DEFAULT CHARSET=utf8mb4 COLLATE=utf8mb4_uca1400_ai_ci
 PARTITION BY RANGE  COLUMNS(`c`)INTERVAL 1 DAY
(PARTITION `p0` VALUES LESS THAN ('2026-04-30') ENGINE = InnoDB)
insert into t1 values ('2026-05-01');
select * from t1;
c
2026-05-01
show create table t1;
Table	Create Table
t1	CREATE TABLE `t1` (
  `c` date DEFAULT NULL
) ENGINE=InnoDB DEFAULT CHARSET=utf8mb4 COLLATE=utf8mb4_uca1400_ai_ci
 PARTITION BY RANGE  COLUMNS(`c`)INTERVAL 1 DAY
(PARTITION `p0` VALUES LESS THAN ('2026-04-30') ENGINE = InnoDB,
 PARTITION `p1` VALUES LESS THAN ('2026-05-01') ENGINE = InnoDB,
 PARTITION `p2` VALUES LESS THAN ('2026-05-02') ENGINE = InnoDB,
 PARTITION `p3` VALUES LESS THAN ('2026-05-03') ENGINE = InnoDB,
 PARTITION `p4` VALUES LESS THAN ('2026-05-04') ENGINE = InnoDB,
 PARTITION `p5` VALUES LESS THAN ('2026-05-05') ENGINE = InnoDB,
 PARTITION `p6` VALUES LESS THAN ('2026-05-06') ENGINE = InnoDB,
 PARTITION `p7` VALUES LESS THAN ('2026-05-07') ENGINE = InnoDB)
select partition_name, partition_method, partition_expression, partition_description, table_rows from information_schema.partitions where table_name='t1';
partition_name	partition_method	partition_expression	partition_description	table_rows
p0	RANGE COLUMNS	`c`	'2026-04-30'	0
p1	RANGE COLUMNS	`c`	'2026-05-01'	0
p2	RANGE COLUMNS	`c`	'2026-05-02'	1
p3	RANGE COLUMNS	`c`	'2026-05-03'	0
p4	RANGE COLUMNS	`c`	'2026-05-04'	0
p5	RANGE COLUMNS	`c`	'2026-05-05'	0
p6	RANGE COLUMNS	`c`	'2026-05-06'	0
p7	RANGE COLUMNS	`c`	'2026-05-07'	0
drop table t1;
# 1.5 day interval truncated to +1d, +2d, +1d, +2d, ...
create table t1 (c date) engine=innodb
PARTITION BY RANGE COLUMNS (c)
INTERVAL 36 Hour
(
PARTITION p0 VALUES LESS THAN ('2026-04-30')
);
show create table t1;
Table	Create Table
t1	CREATE TABLE `t1` (
  `c` date DEFAULT NULL
) ENGINE=InnoDB DEFAULT CHARSET=utf8mb4 COLLATE=utf8mb4_uca1400_ai_ci
 PARTITION BY RANGE  COLUMNS(`c`)INTERVAL 36 HOUR
(PARTITION `p0` VALUES LESS THAN ('2026-04-30') ENGINE = InnoDB)
insert into t1 values ('2026-05-01');
select * from t1;
c
2026-05-01
show create table t1;
Table	Create Table
t1	CREATE TABLE `t1` (
  `c` date DEFAULT NULL
) ENGINE=InnoDB DEFAULT CHARSET=utf8mb4 COLLATE=utf8mb4_uca1400_ai_ci
 PARTITION BY RANGE  COLUMNS(`c`)INTERVAL 36 HOUR
(PARTITION `p0` VALUES LESS THAN ('2026-04-30') ENGINE = InnoDB,
 PARTITION `p1` VALUES LESS THAN ('2026-05-01') ENGINE = InnoDB,
 PARTITION `p2` VALUES LESS THAN ('2026-05-03') ENGINE = InnoDB,
 PARTITION `p3` VALUES LESS THAN ('2026-05-04') ENGINE = InnoDB,
 PARTITION `p4` VALUES LESS THAN ('2026-05-06') ENGINE = InnoDB,
 PARTITION `p5` VALUES LESS THAN ('2026-05-07') ENGINE = InnoDB)
select partition_name, partition_method, partition_expression, partition_description, table_rows from information_schema.partitions where table_name='t1';
partition_name	partition_method	partition_expression	partition_description	table_rows
p0	RANGE COLUMNS	`c`	'2026-04-30'	0
p1	RANGE COLUMNS	`c`	'2026-05-01'	0
p2	RANGE COLUMNS	`c`	'2026-05-03'	1
p3	RANGE COLUMNS	`c`	'2026-05-04'	0
p4	RANGE COLUMNS	`c`	'2026-05-06'	0
p5	RANGE COLUMNS	`c`	'2026-05-07'	0
drop table t1;
create table t1 (c date) engine=innodb
PARTITION BY RANGE COLUMNS (c)
INTERVAL 1 Week
(
PARTITION p0 VALUES LESS THAN ('2026-04-20')
);
show create table t1;
Table	Create Table
t1	CREATE TABLE `t1` (
  `c` date DEFAULT NULL
) ENGINE=InnoDB DEFAULT CHARSET=utf8mb4 COLLATE=utf8mb4_uca1400_ai_ci
 PARTITION BY RANGE  COLUMNS(`c`)INTERVAL 7 DAY
(PARTITION `p0` VALUES LESS THAN ('2026-04-20') ENGINE = InnoDB)
insert into t1 values ('2026-05-01');
select * from t1;
c
2026-05-01
show create table t1;
Table	Create Table
t1	CREATE TABLE `t1` (
  `c` date DEFAULT NULL
) ENGINE=InnoDB DEFAULT CHARSET=utf8mb4 COLLATE=utf8mb4_uca1400_ai_ci
 PARTITION BY RANGE  COLUMNS(`c`)INTERVAL 7 DAY
(PARTITION `p0` VALUES LESS THAN ('2026-04-20') ENGINE = InnoDB,
 PARTITION `p1` VALUES LESS THAN ('2026-04-27') ENGINE = InnoDB,
 PARTITION `p2` VALUES LESS THAN ('2026-05-04') ENGINE = InnoDB,
 PARTITION `p3` VALUES LESS THAN ('2026-05-11') ENGINE = InnoDB)
select partition_name, partition_method, partition_expression, partition_description, table_rows from information_schema.partitions where table_name='t1';
partition_name	partition_method	partition_expression	partition_description	table_rows
p0	RANGE COLUMNS	`c`	'2026-04-20'	0
p1	RANGE COLUMNS	`c`	'2026-04-27'	0
p2	RANGE COLUMNS	`c`	'2026-05-04'	1
p3	RANGE COLUMNS	`c`	'2026-05-11'	0
drop table t1;
create table t1 (c datetime) engine=innodb
PARTITION BY RANGE COLUMNS (c)
INTERVAL 1 hour
(
PARTITION p0 VALUES LESS THAN ('2026-05-05')
);
show create table t1;
Table	Create Table
t1	CREATE TABLE `t1` (
  `c` datetime DEFAULT NULL
) ENGINE=InnoDB DEFAULT CHARSET=utf8mb4 COLLATE=utf8mb4_uca1400_ai_ci
 PARTITION BY RANGE  COLUMNS(`c`)INTERVAL 1 HOUR
(PARTITION `p0` VALUES LESS THAN ('2026-05-05') ENGINE = InnoDB)
insert into t1 values ('2026-05-05 03:00:00');
select * from t1;
c
2026-05-05 03:00:00
show create table t1;
Table	Create Table
t1	CREATE TABLE `t1` (
  `c` datetime DEFAULT NULL
) ENGINE=InnoDB DEFAULT CHARSET=utf8mb4 COLLATE=utf8mb4_uca1400_ai_ci
 PARTITION BY RANGE  COLUMNS(`c`)INTERVAL 1 HOUR
(PARTITION `p0` VALUES LESS THAN ('2026-05-05') ENGINE = InnoDB,
 PARTITION `p1` VALUES LESS THAN ('2026-05-05 01:00:00') ENGINE = InnoDB,
 PARTITION `p2` VALUES LESS THAN ('2026-05-05 02:00:00') ENGINE = InnoDB,
 PARTITION `p3` VALUES LESS THAN ('2026-05-05 03:00:00') ENGINE = InnoDB,
 PARTITION `p4` VALUES LESS THAN ('2026-05-05 04:00:00') ENGINE = InnoDB,
 PARTITION `p5` VALUES LESS THAN ('2026-05-05 05:00:00') ENGINE = InnoDB,
 PARTITION `p6` VALUES LESS THAN ('2026-05-05 06:00:00') ENGINE = InnoDB,
 PARTITION `p7` VALUES LESS THAN ('2026-05-05 07:00:00') ENGINE = InnoDB,
 PARTITION `p8` VALUES LESS THAN ('2026-05-05 08:00:00') ENGINE = InnoDB,
 PARTITION `p9` VALUES LESS THAN ('2026-05-05 09:00:00') ENGINE = InnoDB,
 PARTITION `p10` VALUES LESS THAN ('2026-05-05 10:00:00') ENGINE = InnoDB,
 PARTITION `p11` VALUES LESS THAN ('2026-05-05 11:00:00') ENGINE = InnoDB,
 PARTITION `p12` VALUES LESS THAN ('2026-05-05 12:00:00') ENGINE = InnoDB,
 PARTITION `p13` VALUES LESS THAN ('2026-05-05 13:00:00') ENGINE = InnoDB,
 PARTITION `p14` VALUES LESS THAN ('2026-05-05 14:00:00') ENGINE = InnoDB,
 PARTITION `p15` VALUES LESS THAN ('2026-05-05 15:00:00') ENGINE = InnoDB,
 PARTITION `p16` VALUES LESS THAN ('2026-05-05 16:00:00') ENGINE = InnoDB,
 PARTITION `p17` VALUES LESS THAN ('2026-05-05 17:00:00') ENGINE = InnoDB,
 PARTITION `p18` VALUES LESS THAN ('2026-05-05 18:00:00') ENGINE = InnoDB,
 PARTITION `p19` VALUES LESS THAN ('2026-05-05 19:00:00') ENGINE = InnoDB,
 PARTITION `p20` VALUES LESS THAN ('2026-05-05 20:00:00') ENGINE = InnoDB,
 PARTITION `p21` VALUES LESS THAN ('2026-05-05 21:00:00') ENGINE = InnoDB,
 PARTITION `p22` VALUES LESS THAN ('2026-05-05 22:00:00') ENGINE = InnoDB,
 PARTITION `p23` VALUES LESS THAN ('2026-05-05 23:00:00') ENGINE = InnoDB,
 PARTITION `p24` VALUES LESS THAN ('2026-05-06 00:00:00') ENGINE = InnoDB,
 PARTITION `p25` VALUES LESS THAN ('2026-05-06 01:00:00') ENGINE = InnoDB)
select partition_name, partition_method, partition_expression, partition_description, table_rows from information_schema.partitions where table_name='t1';
partition_name	partition_method	partition_expression	partition_description	table_rows
p0	RANGE COLUMNS	`c`	'2026-05-05'	0
p1	RANGE COLUMNS	`c`	'2026-05-05 01:00:00'	0
p2	RANGE COLUMNS	`c`	'2026-05-05 02:00:00'	0
p3	RANGE COLUMNS	`c`	'2026-05-05 03:00:00'	0
p4	RANGE COLUMNS	`c`	'2026-05-05 04:00:00'	1
p5	RANGE COLUMNS	`c`	'2026-05-05 05:00:00'	0
p6	RANGE COLUMNS	`c`	'2026-05-05 06:00:00'	0
p7	RANGE COLUMNS	`c`	'2026-05-05 07:00:00'	0
p8	RANGE COLUMNS	`c`	'2026-05-05 08:00:00'	0
p9	RANGE COLUMNS	`c`	'2026-05-05 09:00:00'	0
p10	RANGE COLUMNS	`c`	'2026-05-05 10:00:00'	0
p11	RANGE COLUMNS	`c`	'2026-05-05 11:00:00'	0
p12	RANGE COLUMNS	`c`	'2026-05-05 12:00:00'	0
p13	RANGE COLUMNS	`c`	'2026-05-05 13:00:00'	0
p14	RANGE COLUMNS	`c`	'2026-05-05 14:00:00'	0
p15	RANGE COLUMNS	`c`	'2026-05-05 15:00:00'	0
p16	RANGE COLUMNS	`c`	'2026-05-05 16:00:00'	0
p17	RANGE COLUMNS	`c`	'2026-05-05 17:00:00'	0
p18	RANGE COLUMNS	`c`	'2026-05-05 18:00:00'	0
p19	RANGE COLUMNS	`c`	'2026-05-05 19:00:00'	0
p20	RANGE COLUMNS	`c`	'2026-05-05 20:00:00'	0
p21	RANGE COLUMNS	`c`	'2026-05-05 21:00:00'	0
p22	RANGE COLUMNS	`c`	'2026-05-05 22:00:00'	0
p23	RANGE COLUMNS	`c`	'2026-05-05 23:00:00'	0
p24	RANGE COLUMNS	`c`	'2026-05-06 00:00:00'	0
p25	RANGE COLUMNS	`c`	'2026-05-06 01:00:00'	0
drop table t1;
# more than 1 starting partition
create table t1 (c datetime) engine=innodb
PARTITION BY RANGE COLUMNS (c)
INTERVAL 1 Day
(
PARTITION p0 VALUES LESS THAN ('2026-04-20'),
PARTITION p1 VALUES LESS THAN ('2026-04-25')
);
show create table t1;
Table	Create Table
t1	CREATE TABLE `t1` (
  `c` datetime DEFAULT NULL
) ENGINE=InnoDB DEFAULT CHARSET=utf8mb4 COLLATE=utf8mb4_uca1400_ai_ci
 PARTITION BY RANGE  COLUMNS(`c`)INTERVAL 1 DAY
(PARTITION `p0` VALUES LESS THAN ('2026-04-20') ENGINE = InnoDB,
 PARTITION `p1` VALUES LESS THAN ('2026-04-25') ENGINE = InnoDB)
insert into t1 values ('2026-05-01');
select * from t1;
c
2026-05-01 00:00:00
show create table t1;
Table	Create Table
t1	CREATE TABLE `t1` (
  `c` datetime DEFAULT NULL
) ENGINE=InnoDB DEFAULT CHARSET=utf8mb4 COLLATE=utf8mb4_uca1400_ai_ci
 PARTITION BY RANGE  COLUMNS(`c`)INTERVAL 1 DAY
(PARTITION `p0` VALUES LESS THAN ('2026-04-20') ENGINE = InnoDB,
 PARTITION `p1` VALUES LESS THAN ('2026-04-25') ENGINE = InnoDB,
 PARTITION `p2` VALUES LESS THAN ('2026-04-26 00:00:00') ENGINE = InnoDB,
 PARTITION `p3` VALUES LESS THAN ('2026-04-27 00:00:00') ENGINE = InnoDB,
 PARTITION `p4` VALUES LESS THAN ('2026-04-28 00:00:00') ENGINE = InnoDB,
 PARTITION `p5` VALUES LESS THAN ('2026-04-29 00:00:00') ENGINE = InnoDB,
 PARTITION `p6` VALUES LESS THAN ('2026-04-30 00:00:00') ENGINE = InnoDB,
 PARTITION `p7` VALUES LESS THAN ('2026-05-01 00:00:00') ENGINE = InnoDB,
 PARTITION `p8` VALUES LESS THAN ('2026-05-02 00:00:00') ENGINE = InnoDB,
 PARTITION `p9` VALUES LESS THAN ('2026-05-03 00:00:00') ENGINE = InnoDB,
 PARTITION `p10` VALUES LESS THAN ('2026-05-04 00:00:00') ENGINE = InnoDB,
 PARTITION `p11` VALUES LESS THAN ('2026-05-05 00:00:00') ENGINE = InnoDB,
 PARTITION `p12` VALUES LESS THAN ('2026-05-06 00:00:00') ENGINE = InnoDB,
 PARTITION `p13` VALUES LESS THAN ('2026-05-07 00:00:00') ENGINE = InnoDB)
drop table t1;
# no need to create new partition when existing ones are sufficient
create table t1 (c datetime) engine=innodb
PARTITION BY RANGE COLUMNS (c)
INTERVAL 1 Day
(
PARTITION p0 VALUES LESS THAN ('2026-04-01'),
PARTITION p1 VALUES LESS THAN ('2026-05-06')
);
show create table t1;
Table	Create Table
t1	CREATE TABLE `t1` (
  `c` datetime DEFAULT NULL
) ENGINE=InnoDB DEFAULT CHARSET=utf8mb4 COLLATE=utf8mb4_uca1400_ai_ci
 PARTITION BY RANGE  COLUMNS(`c`)INTERVAL 1 DAY
(PARTITION `p0` VALUES LESS THAN ('2026-04-01') ENGINE = InnoDB,
 PARTITION `p1` VALUES LESS THAN ('2026-05-06') ENGINE = InnoDB)
insert into t1 values ('2026-05-01');
select * from t1;
c
2026-05-01 00:00:00
show create table t1;
Table	Create Table
t1	CREATE TABLE `t1` (
  `c` datetime DEFAULT NULL
) ENGINE=InnoDB DEFAULT CHARSET=utf8mb4 COLLATE=utf8mb4_uca1400_ai_ci
 PARTITION BY RANGE  COLUMNS(`c`)INTERVAL 1 DAY
(PARTITION `p0` VALUES LESS THAN ('2026-04-01') ENGINE = InnoDB,
 PARTITION `p1` VALUES LESS THAN ('2026-05-06') ENGINE = InnoDB,
 PARTITION `p2` VALUES LESS THAN ('2026-05-07 00:00:00') ENGINE = InnoDB)
drop table t1;
# find a gap big enough for names of 10 new partition names
create table t1 (c datetime) engine=innodb
PARTITION BY RANGE COLUMNS (c)
INTERVAL 1 Day
(
PARTITION p9 VALUES LESS THAN ('2026-04-01'),
PARTITION p29 VALUES LESS THAN ('2026-04-04'),
PARTITION p19 VALUES LESS THAN ('2026-04-23'),
PARTITION p40 VALUES LESS THAN ('2026-04-27')
);
show create table t1;
Table	Create Table
t1	CREATE TABLE `t1` (
  `c` datetime DEFAULT NULL
) ENGINE=InnoDB DEFAULT CHARSET=utf8mb4 COLLATE=utf8mb4_uca1400_ai_ci
 PARTITION BY RANGE  COLUMNS(`c`)INTERVAL 1 DAY
(PARTITION `p9` VALUES LESS THAN ('2026-04-01') ENGINE = InnoDB,
 PARTITION `p29` VALUES LESS THAN ('2026-04-04') ENGINE = InnoDB,
 PARTITION `p19` VALUES LESS THAN ('2026-04-23') ENGINE = InnoDB,
 PARTITION `p40` VALUES LESS THAN ('2026-04-27') ENGINE = InnoDB)
insert into t1 values ('2026-05-01');
select * from t1;
c
2026-05-01 00:00:00
show create table t1;
Table	Create Table
t1	CREATE TABLE `t1` (
  `c` datetime DEFAULT NULL
) ENGINE=InnoDB DEFAULT CHARSET=utf8mb4 COLLATE=utf8mb4_uca1400_ai_ci
 PARTITION BY RANGE  COLUMNS(`c`)INTERVAL 1 DAY
(PARTITION `p9` VALUES LESS THAN ('2026-04-01') ENGINE = InnoDB,
 PARTITION `p29` VALUES LESS THAN ('2026-04-04') ENGINE = InnoDB,
 PARTITION `p19` VALUES LESS THAN ('2026-04-23') ENGINE = InnoDB,
 PARTITION `p40` VALUES LESS THAN ('2026-04-27') ENGINE = InnoDB,
 PARTITION `p30` VALUES LESS THAN ('2026-04-28 00:00:00') ENGINE = InnoDB,
 PARTITION `p31` VALUES LESS THAN ('2026-04-29 00:00:00') ENGINE = InnoDB,
 PARTITION `p32` VALUES LESS THAN ('2026-04-30 00:00:00') ENGINE = InnoDB,
 PARTITION `p33` VALUES LESS THAN ('2026-05-01 00:00:00') ENGINE = InnoDB,
 PARTITION `p34` VALUES LESS THAN ('2026-05-02 00:00:00') ENGINE = InnoDB,
 PARTITION `p35` VALUES LESS THAN ('2026-05-03 00:00:00') ENGINE = InnoDB,
 PARTITION `p36` VALUES LESS THAN ('2026-05-04 00:00:00') ENGINE = InnoDB,
 PARTITION `p37` VALUES LESS THAN ('2026-05-05 00:00:00') ENGINE = InnoDB,
 PARTITION `p38` VALUES LESS THAN ('2026-05-06 00:00:00') ENGINE = InnoDB,
 PARTITION `p39` VALUES LESS THAN ('2026-05-07 00:00:00') ENGINE = InnoDB)
drop table t1;
create table t1 (c date) engine=innodb
PARTITION BY RANGE COLUMNS (c)
INTERVAL 1 Day
(
PARTITION p40 VALUES LESS THAN ('2026-04-27')
);
show create table t1;
Table	Create Table
t1	CREATE TABLE `t1` (
  `c` date DEFAULT NULL
) ENGINE=InnoDB DEFAULT CHARSET=utf8mb4 COLLATE=utf8mb4_uca1400_ai_ci
 PARTITION BY RANGE  COLUMNS(`c`)INTERVAL 1 DAY
(PARTITION `p40` VALUES LESS THAN ('2026-04-27') ENGINE = InnoDB)
insert into t1 values ('2026-05-01');
select * from t1;
c
2026-05-01
show create table t1;
Table	Create Table
t1	CREATE TABLE `t1` (
  `c` date DEFAULT NULL
) ENGINE=InnoDB DEFAULT CHARSET=utf8mb4 COLLATE=utf8mb4_uca1400_ai_ci
 PARTITION BY RANGE  COLUMNS(`c`)INTERVAL 1 DAY
(PARTITION `p40` VALUES LESS THAN ('2026-04-27') ENGINE = InnoDB,
 PARTITION `p0` VALUES LESS THAN ('2026-04-28') ENGINE = InnoDB,
 PARTITION `p1` VALUES LESS THAN ('2026-04-29') ENGINE = InnoDB,
 PARTITION `p2` VALUES LESS THAN ('2026-04-30') ENGINE = InnoDB,
 PARTITION `p3` VALUES LESS THAN ('2026-05-01') ENGINE = InnoDB,
 PARTITION `p4` VALUES LESS THAN ('2026-05-02') ENGINE = InnoDB,
 PARTITION `p5` VALUES LESS THAN ('2026-05-03') ENGINE = InnoDB,
 PARTITION `p6` VALUES LESS THAN ('2026-05-04') ENGINE = InnoDB,
 PARTITION `p7` VALUES LESS THAN ('2026-05-05') ENGINE = InnoDB,
 PARTITION `p8` VALUES LESS THAN ('2026-05-06') ENGINE = InnoDB,
 PARTITION `p9` VALUES LESS THAN ('2026-05-07') ENGINE = InnoDB)
drop table t1;
# CREATE TABLE ... SELECT
# does not work probably because of MDEV-29769
select to_days('2026-04-01') = 740072;
to_days('2026-04-01') = 740072
1
select to_days('2026-05-01') = 740102;
to_days('2026-05-01') = 740102
1
create table t1 (c date) engine=innodb
PARTITION BY RANGE COLUMNS (c)
INTERVAL 1 Day
(
PARTITION p0 VALUES LESS THAN ('2026-04-01')
)
select from_days(seq) from seq_740073_to_740102;
show create table t1;
Table	Create Table
t1	CREATE TABLE `t1` (
  `c` date DEFAULT NULL,
  `from_days(seq)` date DEFAULT NULL
) ENGINE=InnoDB DEFAULT CHARSET=utf8mb4 COLLATE=utf8mb4_uca1400_ai_ci
select partition_name, partition_method, partition_expression, partition_description, table_rows from information_schema.partitions where table_name='t1';
partition_name	partition_method	partition_expression	partition_description	table_rows
NULL	NULL	NULL	NULL	30
drop table t1;
# INSERT ... SELECT
select to_days('2026-04-01') = 740072;
to_days('2026-04-01') = 740072
1
select to_days('2026-05-01') = 740102;
to_days('2026-05-01') = 740102
1
create table t1 (c date) engine=innodb
PARTITION BY RANGE COLUMNS (c)
INTERVAL 1 Day
(
PARTITION p0 VALUES LESS THAN ('2026-04-01')
);
insert into t1 select from_days(seq) from seq_740073_to_740102;
select * from t1;
c
2026-04-02
2026-04-03
2026-04-04
2026-04-05
2026-04-06
2026-04-07
2026-04-08
2026-04-09
2026-04-10
2026-04-11
2026-04-12
2026-04-13
2026-04-14
2026-04-15
2026-04-16
2026-04-17
2026-04-18
2026-04-19
2026-04-20
2026-04-21
2026-04-22
2026-04-23
2026-04-24
2026-04-25
2026-04-26
2026-04-27
2026-04-28
2026-04-29
2026-04-30
2026-05-01
show create table t1;
Table	Create Table
t1	CREATE TABLE `t1` (
  `c` date DEFAULT NULL
) ENGINE=InnoDB DEFAULT CHARSET=utf8mb4 COLLATE=utf8mb4_uca1400_ai_ci
 PARTITION BY RANGE  COLUMNS(`c`)INTERVAL 1 DAY
(PARTITION `p0` VALUES LESS THAN ('2026-04-01') ENGINE = InnoDB,
 PARTITION `p1` VALUES LESS THAN ('2026-04-02') ENGINE = InnoDB,
 PARTITION `p2` VALUES LESS THAN ('2026-04-03') ENGINE = InnoDB,
 PARTITION `p3` VALUES LESS THAN ('2026-04-04') ENGINE = InnoDB,
 PARTITION `p4` VALUES LESS THAN ('2026-04-05') ENGINE = InnoDB,
 PARTITION `p5` VALUES LESS THAN ('2026-04-06') ENGINE = InnoDB,
 PARTITION `p6` VALUES LESS THAN ('2026-04-07') ENGINE = InnoDB,
 PARTITION `p7` VALUES LESS THAN ('2026-04-08') ENGINE = InnoDB,
 PARTITION `p8` VALUES LESS THAN ('2026-04-09') ENGINE = InnoDB,
 PARTITION `p9` VALUES LESS THAN ('2026-04-10') ENGINE = InnoDB,
 PARTITION `p10` VALUES LESS THAN ('2026-04-11') ENGINE = InnoDB,
 PARTITION `p11` VALUES LESS THAN ('2026-04-12') ENGINE = InnoDB,
 PARTITION `p12` VALUES LESS THAN ('2026-04-13') ENGINE = InnoDB,
 PARTITION `p13` VALUES LESS THAN ('2026-04-14') ENGINE = InnoDB,
 PARTITION `p14` VALUES LESS THAN ('2026-04-15') ENGINE = InnoDB,
 PARTITION `p15` VALUES LESS THAN ('2026-04-16') ENGINE = InnoDB,
 PARTITION `p16` VALUES LESS THAN ('2026-04-17') ENGINE = InnoDB,
 PARTITION `p17` VALUES LESS THAN ('2026-04-18') ENGINE = InnoDB,
 PARTITION `p18` VALUES LESS THAN ('2026-04-19') ENGINE = InnoDB,
 PARTITION `p19` VALUES LESS THAN ('2026-04-20') ENGINE = InnoDB,
 PARTITION `p20` VALUES LESS THAN ('2026-04-21') ENGINE = InnoDB,
 PARTITION `p21` VALUES LESS THAN ('2026-04-22') ENGINE = InnoDB,
 PARTITION `p22` VALUES LESS THAN ('2026-04-23') ENGINE = InnoDB,
 PARTITION `p23` VALUES LESS THAN ('2026-04-24') ENGINE = InnoDB,
 PARTITION `p24` VALUES LESS THAN ('2026-04-25') ENGINE = InnoDB,
 PARTITION `p25` VALUES LESS THAN ('2026-04-26') ENGINE = InnoDB,
 PARTITION `p26` VALUES LESS THAN ('2026-04-27') ENGINE = InnoDB,
 PARTITION `p27` VALUES LESS THAN ('2026-04-28') ENGINE = InnoDB,
 PARTITION `p28` VALUES LESS THAN ('2026-04-29') ENGINE = InnoDB,
 PARTITION `p29` VALUES LESS THAN ('2026-04-30') ENGINE = InnoDB,
 PARTITION `p30` VALUES LESS THAN ('2026-05-01') ENGINE = InnoDB,
 PARTITION `p31` VALUES LESS THAN ('2026-05-02') ENGINE = InnoDB,
 PARTITION `p32` VALUES LESS THAN ('2026-05-03') ENGINE = InnoDB,
 PARTITION `p33` VALUES LESS THAN ('2026-05-04') ENGINE = InnoDB,
 PARTITION `p34` VALUES LESS THAN ('2026-05-05') ENGINE = InnoDB,
 PARTITION `p35` VALUES LESS THAN ('2026-05-06') ENGINE = InnoDB,
 PARTITION `p36` VALUES LESS THAN ('2026-05-07') ENGINE = InnoDB)
select partition_name, partition_method, partition_expression, partition_description, table_rows from information_schema.partitions where table_name='t1';
partition_name	partition_method	partition_expression	partition_description	table_rows
p0	RANGE COLUMNS	`c`	'2026-04-01'	0
p1	RANGE COLUMNS	`c`	'2026-04-02'	0
p2	RANGE COLUMNS	`c`	'2026-04-03'	1
p3	RANGE COLUMNS	`c`	'2026-04-04'	1
p4	RANGE COLUMNS	`c`	'2026-04-05'	1
p5	RANGE COLUMNS	`c`	'2026-04-06'	1
p6	RANGE COLUMNS	`c`	'2026-04-07'	1
p7	RANGE COLUMNS	`c`	'2026-04-08'	1
p8	RANGE COLUMNS	`c`	'2026-04-09'	1
p9	RANGE COLUMNS	`c`	'2026-04-10'	1
p10	RANGE COLUMNS	`c`	'2026-04-11'	1
p11	RANGE COLUMNS	`c`	'2026-04-12'	1
p12	RANGE COLUMNS	`c`	'2026-04-13'	1
p13	RANGE COLUMNS	`c`	'2026-04-14'	1
p14	RANGE COLUMNS	`c`	'2026-04-15'	1
p15	RANGE COLUMNS	`c`	'2026-04-16'	1
p16	RANGE COLUMNS	`c`	'2026-04-17'	1
p17	RANGE COLUMNS	`c`	'2026-04-18'	1
p18	RANGE COLUMNS	`c`	'2026-04-19'	1
p19	RANGE COLUMNS	`c`	'2026-04-20'	1
p20	RANGE COLUMNS	`c`	'2026-04-21'	1
p21	RANGE COLUMNS	`c`	'2026-04-22'	1
p22	RANGE COLUMNS	`c`	'2026-04-23'	1
p23	RANGE COLUMNS	`c`	'2026-04-24'	1
p24	RANGE COLUMNS	`c`	'2026-04-25'	1
p25	RANGE COLUMNS	`c`	'2026-04-26'	1
p26	RANGE COLUMNS	`c`	'2026-04-27'	1
p27	RANGE COLUMNS	`c`	'2026-04-28'	1
p28	RANGE COLUMNS	`c`	'2026-04-29'	1
p29	RANGE COLUMNS	`c`	'2026-04-30'	1
p30	RANGE COLUMNS	`c`	'2026-05-01'	1
p31	RANGE COLUMNS	`c`	'2026-05-02'	1
p32	RANGE COLUMNS	`c`	'2026-05-03'	0
p33	RANGE COLUMNS	`c`	'2026-05-04'	0
p34	RANGE COLUMNS	`c`	'2026-05-05'	0
p35	RANGE COLUMNS	`c`	'2026-05-06'	0
p36	RANGE COLUMNS	`c`	'2026-05-07'	0
drop table t1;
select to_days('2026-05-01') = 740102;
to_days('2026-05-01') = 740102
1
select to_days('2026-05-08') = 740109;
to_days('2026-05-08') = 740109
1
create table t1 (c date) engine=innodb
PARTITION BY RANGE COLUMNS (c)
INTERVAL 1 Day
(
PARTITION p0 VALUES LESS THAN ('2026-04-01')
);
insert into t1 select from_days(seq) from seq_740102_to_740109;
ERROR HY000: Table has no partition for value from column_list
select * from t1;
c
show create table t1;
Table	Create Table
t1	CREATE TABLE `t1` (
  `c` date DEFAULT NULL
) ENGINE=InnoDB DEFAULT CHARSET=utf8mb4 COLLATE=utf8mb4_uca1400_ai_ci
 PARTITION BY RANGE  COLUMNS(`c`)INTERVAL 1 DAY
(PARTITION `p0` VALUES LESS THAN ('2026-04-01') ENGINE = InnoDB,
 PARTITION `p1` VALUES LESS THAN ('2026-04-02') ENGINE = InnoDB,
 PARTITION `p2` VALUES LESS THAN ('2026-04-03') ENGINE = InnoDB,
 PARTITION `p3` VALUES LESS THAN ('2026-04-04') ENGINE = InnoDB,
 PARTITION `p4` VALUES LESS THAN ('2026-04-05') ENGINE = InnoDB,
 PARTITION `p5` VALUES LESS THAN ('2026-04-06') ENGINE = InnoDB,
 PARTITION `p6` VALUES LESS THAN ('2026-04-07') ENGINE = InnoDB,
 PARTITION `p7` VALUES LESS THAN ('2026-04-08') ENGINE = InnoDB,
 PARTITION `p8` VALUES LESS THAN ('2026-04-09') ENGINE = InnoDB,
 PARTITION `p9` VALUES LESS THAN ('2026-04-10') ENGINE = InnoDB,
 PARTITION `p10` VALUES LESS THAN ('2026-04-11') ENGINE = InnoDB,
 PARTITION `p11` VALUES LESS THAN ('2026-04-12') ENGINE = InnoDB,
 PARTITION `p12` VALUES LESS THAN ('2026-04-13') ENGINE = InnoDB,
 PARTITION `p13` VALUES LESS THAN ('2026-04-14') ENGINE = InnoDB,
 PARTITION `p14` VALUES LESS THAN ('2026-04-15') ENGINE = InnoDB,
 PARTITION `p15` VALUES LESS THAN ('2026-04-16') ENGINE = InnoDB,
 PARTITION `p16` VALUES LESS THAN ('2026-04-17') ENGINE = InnoDB,
 PARTITION `p17` VALUES LESS THAN ('2026-04-18') ENGINE = InnoDB,
 PARTITION `p18` VALUES LESS THAN ('2026-04-19') ENGINE = InnoDB,
 PARTITION `p19` VALUES LESS THAN ('2026-04-20') ENGINE = InnoDB,
 PARTITION `p20` VALUES LESS THAN ('2026-04-21') ENGINE = InnoDB,
 PARTITION `p21` VALUES LESS THAN ('2026-04-22') ENGINE = InnoDB,
 PARTITION `p22` VALUES LESS THAN ('2026-04-23') ENGINE = InnoDB,
 PARTITION `p23` VALUES LESS THAN ('2026-04-24') ENGINE = InnoDB,
 PARTITION `p24` VALUES LESS THAN ('2026-04-25') ENGINE = InnoDB,
 PARTITION `p25` VALUES LESS THAN ('2026-04-26') ENGINE = InnoDB,
 PARTITION `p26` VALUES LESS THAN ('2026-04-27') ENGINE = InnoDB,
 PARTITION `p27` VALUES LESS THAN ('2026-04-28') ENGINE = InnoDB,
 PARTITION `p28` VALUES LESS THAN ('2026-04-29') ENGINE = InnoDB,
 PARTITION `p29` VALUES LESS THAN ('2026-04-30') ENGINE = InnoDB,
 PARTITION `p30` VALUES LESS THAN ('2026-05-01') ENGINE = InnoDB,
 PARTITION `p31` VALUES LESS THAN ('2026-05-02') ENGINE = InnoDB,
 PARTITION `p32` VALUES LESS THAN ('2026-05-03') ENGINE = InnoDB,
 PARTITION `p33` VALUES LESS THAN ('2026-05-04') ENGINE = InnoDB,
 PARTITION `p34` VALUES LESS THAN ('2026-05-05') ENGINE = InnoDB,
 PARTITION `p35` VALUES LESS THAN ('2026-05-06') ENGINE = InnoDB,
 PARTITION `p36` VALUES LESS THAN ('2026-05-07') ENGINE = InnoDB)
select partition_name, partition_method, partition_expression, partition_description, table_rows from information_schema.partitions where table_name='t1' and table_rows > 0;
partition_name	partition_method	partition_expression	partition_description	table_rows
drop table t1;
# LOAD DATA INFILE
create table t1 (c date) engine=innodb
PARTITION BY RANGE COLUMNS (c)
INTERVAL 1 Day
(
PARTITION p0 VALUES LESS THAN ('2026-04-20')
);
load data infile 'load.data' ignore into table t1;
show create table t1;
Table	Create Table
t1	CREATE TABLE `t1` (
  `c` date DEFAULT NULL
) ENGINE=InnoDB DEFAULT CHARSET=utf8mb4 COLLATE=utf8mb4_uca1400_ai_ci
 PARTITION BY RANGE  COLUMNS(`c`)INTERVAL 1 DAY
(PARTITION `p0` VALUES LESS THAN ('2026-04-20') ENGINE = InnoDB,
 PARTITION `p1` VALUES LESS THAN ('2026-04-21') ENGINE = InnoDB,
 PARTITION `p2` VALUES LESS THAN ('2026-04-22') ENGINE = InnoDB,
 PARTITION `p3` VALUES LESS THAN ('2026-04-23') ENGINE = InnoDB,
 PARTITION `p4` VALUES LESS THAN ('2026-04-24') ENGINE = InnoDB,
 PARTITION `p5` VALUES LESS THAN ('2026-04-25') ENGINE = InnoDB,
 PARTITION `p6` VALUES LESS THAN ('2026-04-26') ENGINE = InnoDB,
 PARTITION `p7` VALUES LESS THAN ('2026-04-27') ENGINE = InnoDB,
 PARTITION `p8` VALUES LESS THAN ('2026-04-28') ENGINE = InnoDB,
 PARTITION `p9` VALUES LESS THAN ('2026-04-29') ENGINE = InnoDB,
 PARTITION `p10` VALUES LESS THAN ('2026-04-30') ENGINE = InnoDB,
 PARTITION `p11` VALUES LESS THAN ('2026-05-01') ENGINE = InnoDB,
 PARTITION `p12` VALUES LESS THAN ('2026-05-02') ENGINE = InnoDB,
 PARTITION `p13` VALUES LESS THAN ('2026-05-03') ENGINE = InnoDB,
 PARTITION `p14` VALUES LESS THAN ('2026-05-04') ENGINE = InnoDB,
 PARTITION `p15` VALUES LESS THAN ('2026-05-05') ENGINE = InnoDB,
 PARTITION `p16` VALUES LESS THAN ('2026-05-06') ENGINE = InnoDB,
 PARTITION `p17` VALUES LESS THAN ('2026-05-07') ENGINE = InnoDB)
select partition_name, partition_method, partition_expression, partition_description, table_rows from information_schema.partitions where table_name='t1' and table_rows > 0;
partition_name	partition_method	partition_expression	partition_description	table_rows
p12	RANGE COLUMNS	`c`	'2026-05-02'	1
p13	RANGE COLUMNS	`c`	'2026-05-03'	1
p14	RANGE COLUMNS	`c`	'2026-05-04'	1
p15	RANGE COLUMNS	`c`	'2026-05-05'	1
p16	RANGE COLUMNS	`c`	'2026-05-06'	1
drop table t1;
# LOAD DATA INFILE is not atomic
create table t1 (c date) engine=innodb
PARTITION BY RANGE COLUMNS (c)
INTERVAL 1 Day
(
PARTITION p0 VALUES LESS THAN ('2026-04-20')
);
load data infile 'load.data' ignore into table t1;
Warnings:
Warning	1526	Table has no partition for value from column_list
Warning	1526	Table has no partition for value from column_list
select * from t1;
c
2026-05-05
2026-05-06
show create table t1;
Table	Create Table
t1	CREATE TABLE `t1` (
  `c` date DEFAULT NULL
) ENGINE=InnoDB DEFAULT CHARSET=utf8mb4 COLLATE=utf8mb4_uca1400_ai_ci
 PARTITION BY RANGE  COLUMNS(`c`)INTERVAL 1 DAY
(PARTITION `p0` VALUES LESS THAN ('2026-04-20') ENGINE = InnoDB,
 PARTITION `p1` VALUES LESS THAN ('2026-04-21') ENGINE = InnoDB,
 PARTITION `p2` VALUES LESS THAN ('2026-04-22') ENGINE = InnoDB,
 PARTITION `p3` VALUES LESS THAN ('2026-04-23') ENGINE = InnoDB,
 PARTITION `p4` VALUES LESS THAN ('2026-04-24') ENGINE = InnoDB,
 PARTITION `p5` VALUES LESS THAN ('2026-04-25') ENGINE = InnoDB,
 PARTITION `p6` VALUES LESS THAN ('2026-04-26') ENGINE = InnoDB,
 PARTITION `p7` VALUES LESS THAN ('2026-04-27') ENGINE = InnoDB,
 PARTITION `p8` VALUES LESS THAN ('2026-04-28') ENGINE = InnoDB,
 PARTITION `p9` VALUES LESS THAN ('2026-04-29') ENGINE = InnoDB,
 PARTITION `p10` VALUES LESS THAN ('2026-04-30') ENGINE = InnoDB,
 PARTITION `p11` VALUES LESS THAN ('2026-05-01') ENGINE = InnoDB,
 PARTITION `p12` VALUES LESS THAN ('2026-05-02') ENGINE = InnoDB,
 PARTITION `p13` VALUES LESS THAN ('2026-05-03') ENGINE = InnoDB,
 PARTITION `p14` VALUES LESS THAN ('2026-05-04') ENGINE = InnoDB,
 PARTITION `p15` VALUES LESS THAN ('2026-05-05') ENGINE = InnoDB,
 PARTITION `p16` VALUES LESS THAN ('2026-05-06') ENGINE = InnoDB,
 PARTITION `p17` VALUES LESS THAN ('2026-05-07') ENGINE = InnoDB)
select partition_name, partition_method, partition_expression, partition_description, table_rows from information_schema.partitions where table_name='t1' and table_rows > 0;
partition_name	partition_method	partition_expression	partition_description	table_rows
p16	RANGE COLUMNS	`c`	'2026-05-06'	1
p17	RANGE COLUMNS	`c`	'2026-05-07'	1
drop table t1;
# UPDATE
set timestamp= unix_timestamp('2026-05-02 00:00:00');
create table t1 (c date) engine=innodb
PARTITION BY RANGE COLUMNS (c)
INTERVAL 1 Day
(
PARTITION p0 VALUES LESS THAN ('2026-04-25')
);
insert into t1 values ('2026-04-28'), ('2026-04-29'), ('2026-04-30');
select * from t1;
c
2026-04-28
2026-04-29
2026-04-30
show create table t1;
Table	Create Table
t1	CREATE TABLE `t1` (
  `c` date DEFAULT NULL
) ENGINE=InnoDB DEFAULT CHARSET=utf8mb4 COLLATE=utf8mb4_uca1400_ai_ci
 PARTITION BY RANGE  COLUMNS(`c`)INTERVAL 1 DAY
(PARTITION `p0` VALUES LESS THAN ('2026-04-25') ENGINE = InnoDB,
 PARTITION `p1` VALUES LESS THAN ('2026-04-26') ENGINE = InnoDB,
 PARTITION `p2` VALUES LESS THAN ('2026-04-27') ENGINE = InnoDB,
 PARTITION `p3` VALUES LESS THAN ('2026-04-28') ENGINE = InnoDB,
 PARTITION `p4` VALUES LESS THAN ('2026-04-29') ENGINE = InnoDB,
 PARTITION `p5` VALUES LESS THAN ('2026-04-30') ENGINE = InnoDB,
 PARTITION `p6` VALUES LESS THAN ('2026-05-01') ENGINE = InnoDB,
 PARTITION `p7` VALUES LESS THAN ('2026-05-02') ENGINE = InnoDB,
 PARTITION `p8` VALUES LESS THAN ('2026-05-03') ENGINE = InnoDB)
select partition_name, partition_method, partition_expression, partition_description, table_rows from information_schema.partitions where table_name='t1' and table_rows > 0;
partition_name	partition_method	partition_expression	partition_description	table_rows
p4	RANGE COLUMNS	`c`	'2026-04-29'	1
p5	RANGE COLUMNS	`c`	'2026-04-30'	1
p6	RANGE COLUMNS	`c`	'2026-05-01'	1
set timestamp= unix_timestamp('2026-05-06 00:00:00');
update t1 set c = date_add(c, interval 6 day);
select * from t1;
c
2026-05-04
2026-05-05
2026-05-06
show create table t1;
Table	Create Table
t1	CREATE TABLE `t1` (
  `c` date DEFAULT NULL
) ENGINE=InnoDB DEFAULT CHARSET=utf8mb4 COLLATE=utf8mb4_uca1400_ai_ci
 PARTITION BY RANGE  COLUMNS(`c`)INTERVAL 1 DAY
(PARTITION `p0` VALUES LESS THAN ('2026-04-25') ENGINE = InnoDB,
 PARTITION `p1` VALUES LESS THAN ('2026-04-26') ENGINE = InnoDB,
 PARTITION `p2` VALUES LESS THAN ('2026-04-27') ENGINE = InnoDB,
 PARTITION `p3` VALUES LESS THAN ('2026-04-28') ENGINE = InnoDB,
 PARTITION `p4` VALUES LESS THAN ('2026-04-29') ENGINE = InnoDB,
 PARTITION `p5` VALUES LESS THAN ('2026-04-30') ENGINE = InnoDB,
 PARTITION `p6` VALUES LESS THAN ('2026-05-01') ENGINE = InnoDB,
 PARTITION `p7` VALUES LESS THAN ('2026-05-02') ENGINE = InnoDB,
 PARTITION `p8` VALUES LESS THAN ('2026-05-03') ENGINE = InnoDB,
 PARTITION `p9` VALUES LESS THAN ('2026-05-04') ENGINE = InnoDB,
 PARTITION `p10` VALUES LESS THAN ('2026-05-05') ENGINE = InnoDB,
 PARTITION `p11` VALUES LESS THAN ('2026-05-06') ENGINE = InnoDB,
 PARTITION `p12` VALUES LESS THAN ('2026-05-07') ENGINE = InnoDB)
select partition_name, partition_method, partition_expression, partition_description, table_rows from information_schema.partitions where table_name='t1' and table_rows > 0;
partition_name	partition_method	partition_expression	partition_description	table_rows
p10	RANGE COLUMNS	`c`	'2026-05-05'	1
p11	RANGE COLUMNS	`c`	'2026-05-06'	1
p12	RANGE COLUMNS	`c`	'2026-05-07'	1
set timestamp= unix_timestamp('2026-05-08 00:00:00');
update t1 set c = date_add(c, interval 3 day);
ERROR HY000: Table has no partition for value from column_list
select * from t1;
c
2026-05-04
2026-05-05
2026-05-06
show create table t1;
Table	Create Table
t1	CREATE TABLE `t1` (
  `c` date DEFAULT NULL
) ENGINE=InnoDB DEFAULT CHARSET=utf8mb4 COLLATE=utf8mb4_uca1400_ai_ci
 PARTITION BY RANGE  COLUMNS(`c`)INTERVAL 1 DAY
(PARTITION `p0` VALUES LESS THAN ('2026-04-25') ENGINE = InnoDB,
 PARTITION `p1` VALUES LESS THAN ('2026-04-26') ENGINE = InnoDB,
 PARTITION `p2` VALUES LESS THAN ('2026-04-27') ENGINE = InnoDB,
 PARTITION `p3` VALUES LESS THAN ('2026-04-28') ENGINE = InnoDB,
 PARTITION `p4` VALUES LESS THAN ('2026-04-29') ENGINE = InnoDB,
 PARTITION `p5` VALUES LESS THAN ('2026-04-30') ENGINE = InnoDB,
 PARTITION `p6` VALUES LESS THAN ('2026-05-01') ENGINE = InnoDB,
 PARTITION `p7` VALUES LESS THAN ('2026-05-02') ENGINE = InnoDB,
 PARTITION `p8` VALUES LESS THAN ('2026-05-03') ENGINE = InnoDB,
 PARTITION `p9` VALUES LESS THAN ('2026-05-04') ENGINE = InnoDB,
 PARTITION `p10` VALUES LESS THAN ('2026-05-05') ENGINE = InnoDB,
 PARTITION `p11` VALUES LESS THAN ('2026-05-06') ENGINE = InnoDB,
 PARTITION `p12` VALUES LESS THAN ('2026-05-07') ENGINE = InnoDB,
 PARTITION `p13` VALUES LESS THAN ('2026-05-08') ENGINE = InnoDB,
 PARTITION `p14` VALUES LESS THAN ('2026-05-09') ENGINE = InnoDB)
select partition_name, partition_method, partition_expression, partition_description, table_rows from information_schema.partitions where table_name='t1' and table_rows > 0;
partition_name	partition_method	partition_expression	partition_description	table_rows
p10	RANGE COLUMNS	`c`	'2026-05-05'	1
p11	RANGE COLUMNS	`c`	'2026-05-06'	1
p12	RANGE COLUMNS	`c`	'2026-05-07'	1
set timestamp= unix_timestamp('2026-05-06 00:00:00');
drop table t1;
# ALTER TABLE
create table t1 (c date) engine=innodb
PARTITION BY RANGE COLUMNS (c)
(
PARTITION p0 VALUES LESS THAN ('2026-04-25')
);
insert into t1 values ('2026-05-01');
ERROR HY000: Table has no partition for value from column_list
ALTER TABLE t1 PARTITION BY RANGE COLUMNS (c) INTERVAL 1 DAY
(
PARTITION p0 VALUES LESS THAN ('2026-04-25')
);
insert into t1 values ('2026-05-01');
SELECT * FROM t1;
c
2026-05-01
show create table t1;
Table	Create Table
t1	CREATE TABLE `t1` (
  `c` date DEFAULT NULL
) ENGINE=InnoDB DEFAULT CHARSET=utf8mb4 COLLATE=utf8mb4_uca1400_ai_ci
 PARTITION BY RANGE  COLUMNS(`c`)INTERVAL 1 DAY
(PARTITION `p0` VALUES LESS THAN ('2026-04-25') ENGINE = InnoDB,
 PARTITION `p1` VALUES LESS THAN ('2026-04-26') ENGINE = InnoDB,
 PARTITION `p2` VALUES LESS THAN ('2026-04-27') ENGINE = InnoDB,
 PARTITION `p3` VALUES LESS THAN ('2026-04-28') ENGINE = InnoDB,
 PARTITION `p4` VALUES LESS THAN ('2026-04-29') ENGINE = InnoDB,
 PARTITION `p5` VALUES LESS THAN ('2026-04-30') ENGINE = InnoDB,
 PARTITION `p6` VALUES LESS THAN ('2026-05-01') ENGINE = InnoDB,
 PARTITION `p7` VALUES LESS THAN ('2026-05-02') ENGINE = InnoDB,
 PARTITION `p8` VALUES LESS THAN ('2026-05-03') ENGINE = InnoDB,
 PARTITION `p9` VALUES LESS THAN ('2026-05-04') ENGINE = InnoDB,
 PARTITION `p10` VALUES LESS THAN ('2026-05-05') ENGINE = InnoDB,
 PARTITION `p11` VALUES LESS THAN ('2026-05-06') ENGINE = InnoDB,
 PARTITION `p12` VALUES LESS THAN ('2026-05-07') ENGINE = InnoDB)
select partition_name, partition_method, partition_expression, partition_description, table_rows from information_schema.partitions where table_name='t1' and table_rows > 0;
partition_name	partition_method	partition_expression	partition_description	table_rows
p7	RANGE COLUMNS	`c`	'2026-05-02'	1
drop table t1;
# failing insertion of dates in the future
create table t1 (c datetime) engine=innodb
PARTITION BY RANGE COLUMNS (c)
INTERVAL 1 Day
(
PARTITION p0 VALUES LESS THAN ('2026-04-01')
);
show create table t1;
Table	Create Table
t1	CREATE TABLE `t1` (
  `c` datetime DEFAULT NULL
) ENGINE=InnoDB DEFAULT CHARSET=utf8mb4 COLLATE=utf8mb4_uca1400_ai_ci
 PARTITION BY RANGE  COLUMNS(`c`)INTERVAL 1 DAY
(PARTITION `p0` VALUES LESS THAN ('2026-04-01') ENGINE = InnoDB)
insert into t1 values ('2026-05-07');
ERROR HY000: Table has no partition for value from column_list
show create table t1;
Table	Create Table
t1	CREATE TABLE `t1` (
  `c` datetime DEFAULT NULL
) ENGINE=InnoDB DEFAULT CHARSET=utf8mb4 COLLATE=utf8mb4_uca1400_ai_ci
 PARTITION BY RANGE  COLUMNS(`c`)INTERVAL 1 DAY
(PARTITION `p0` VALUES LESS THAN ('2026-04-01') ENGINE = InnoDB,
 PARTITION `p1` VALUES LESS THAN ('2026-04-02 00:00:00') ENGINE = InnoDB,
 PARTITION `p2` VALUES LESS THAN ('2026-04-03 00:00:00') ENGINE = InnoDB,
 PARTITION `p3` VALUES LESS THAN ('2026-04-04 00:00:00') ENGINE = InnoDB,
 PARTITION `p4` VALUES LESS THAN ('2026-04-05 00:00:00') ENGINE = InnoDB,
 PARTITION `p5` VALUES LESS THAN ('2026-04-06 00:00:00') ENGINE = InnoDB,
 PARTITION `p6` VALUES LESS THAN ('2026-04-07 00:00:00') ENGINE = InnoDB,
 PARTITION `p7` VALUES LESS THAN ('2026-04-08 00:00:00') ENGINE = InnoDB,
 PARTITION `p8` VALUES LESS THAN ('2026-04-09 00:00:00') ENGINE = InnoDB,
 PARTITION `p9` VALUES LESS THAN ('2026-04-10 00:00:00') ENGINE = InnoDB,
 PARTITION `p10` VALUES LESS THAN ('2026-04-11 00:00:00') ENGINE = InnoDB,
 PARTITION `p11` VALUES LESS THAN ('2026-04-12 00:00:00') ENGINE = InnoDB,
 PARTITION `p12` VALUES LESS THAN ('2026-04-13 00:00:00') ENGINE = InnoDB,
 PARTITION `p13` VALUES LESS THAN ('2026-04-14 00:00:00') ENGINE = InnoDB,
 PARTITION `p14` VALUES LESS THAN ('2026-04-15 00:00:00') ENGINE = InnoDB,
 PARTITION `p15` VALUES LESS THAN ('2026-04-16 00:00:00') ENGINE = InnoDB,
 PARTITION `p16` VALUES LESS THAN ('2026-04-17 00:00:00') ENGINE = InnoDB,
 PARTITION `p17` VALUES LESS THAN ('2026-04-18 00:00:00') ENGINE = InnoDB,
 PARTITION `p18` VALUES LESS THAN ('2026-04-19 00:00:00') ENGINE = InnoDB,
 PARTITION `p19` VALUES LESS THAN ('2026-04-20 00:00:00') ENGINE = InnoDB,
 PARTITION `p20` VALUES LESS THAN ('2026-04-21 00:00:00') ENGINE = InnoDB,
 PARTITION `p21` VALUES LESS THAN ('2026-04-22 00:00:00') ENGINE = InnoDB,
 PARTITION `p22` VALUES LESS THAN ('2026-04-23 00:00:00') ENGINE = InnoDB,
 PARTITION `p23` VALUES LESS THAN ('2026-04-24 00:00:00') ENGINE = InnoDB,
 PARTITION `p24` VALUES LESS THAN ('2026-04-25 00:00:00') ENGINE = InnoDB,
 PARTITION `p25` VALUES LESS THAN ('2026-04-26 00:00:00') ENGINE = InnoDB,
 PARTITION `p26` VALUES LESS THAN ('2026-04-27 00:00:00') ENGINE = InnoDB,
 PARTITION `p27` VALUES LESS THAN ('2026-04-28 00:00:00') ENGINE = InnoDB,
 PARTITION `p28` VALUES LESS THAN ('2026-04-29 00:00:00') ENGINE = InnoDB,
 PARTITION `p29` VALUES LESS THAN ('2026-04-30 00:00:00') ENGINE = InnoDB,
 PARTITION `p30` VALUES LESS THAN ('2026-05-01 00:00:00') ENGINE = InnoDB,
 PARTITION `p31` VALUES LESS THAN ('2026-05-02 00:00:00') ENGINE = InnoDB,
 PARTITION `p32` VALUES LESS THAN ('2026-05-03 00:00:00') ENGINE = InnoDB,
 PARTITION `p33` VALUES LESS THAN ('2026-05-04 00:00:00') ENGINE = InnoDB,
 PARTITION `p34` VALUES LESS THAN ('2026-05-05 00:00:00') ENGINE = InnoDB,
 PARTITION `p35` VALUES LESS THAN ('2026-05-06 00:00:00') ENGINE = InnoDB,
 PARTITION `p36` VALUES LESS THAN ('2026-05-07 00:00:00') ENGINE = InnoDB)
drop table t1;
# passthrough behaviour
create table t1 (c datetime) engine=innodb
PARTITION BY RANGE COLUMNS (c)
INTERVAL 1 Day
(
PARTITION p0 VALUES LESS THAN ('2026-04-01')
);
show create table t1;
Table	Create Table
t1	CREATE TABLE `t1` (
  `c` datetime DEFAULT NULL
) ENGINE=InnoDB DEFAULT CHARSET=utf8mb4 COLLATE=utf8mb4_uca1400_ai_ci
 PARTITION BY RANGE  COLUMNS(`c`)INTERVAL 1 DAY
(PARTITION `p0` VALUES LESS THAN ('2026-04-01') ENGINE = InnoDB)
begin;
insert into t1 values ('2026-05-01');
insert into t1 values ('2026-05-02');
select * from t1;
c
2026-05-01 00:00:00
2026-05-02 00:00:00
rollback;
select * from t1;
c
show create table t1;
Table	Create Table
t1	CREATE TABLE `t1` (
  `c` datetime DEFAULT NULL
) ENGINE=InnoDB DEFAULT CHARSET=utf8mb4 COLLATE=utf8mb4_uca1400_ai_ci
 PARTITION BY RANGE  COLUMNS(`c`)INTERVAL 1 DAY
(PARTITION `p0` VALUES LESS THAN ('2026-04-01') ENGINE = InnoDB,
 PARTITION `p1` VALUES LESS THAN ('2026-04-02 00:00:00') ENGINE = InnoDB,
 PARTITION `p2` VALUES LESS THAN ('2026-04-03 00:00:00') ENGINE = InnoDB,
 PARTITION `p3` VALUES LESS THAN ('2026-04-04 00:00:00') ENGINE = InnoDB,
 PARTITION `p4` VALUES LESS THAN ('2026-04-05 00:00:00') ENGINE = InnoDB,
 PARTITION `p5` VALUES LESS THAN ('2026-04-06 00:00:00') ENGINE = InnoDB,
 PARTITION `p6` VALUES LESS THAN ('2026-04-07 00:00:00') ENGINE = InnoDB,
 PARTITION `p7` VALUES LESS THAN ('2026-04-08 00:00:00') ENGINE = InnoDB,
 PARTITION `p8` VALUES LESS THAN ('2026-04-09 00:00:00') ENGINE = InnoDB,
 PARTITION `p9` VALUES LESS THAN ('2026-04-10 00:00:00') ENGINE = InnoDB,
 PARTITION `p10` VALUES LESS THAN ('2026-04-11 00:00:00') ENGINE = InnoDB,
 PARTITION `p11` VALUES LESS THAN ('2026-04-12 00:00:00') ENGINE = InnoDB,
 PARTITION `p12` VALUES LESS THAN ('2026-04-13 00:00:00') ENGINE = InnoDB,
 PARTITION `p13` VALUES LESS THAN ('2026-04-14 00:00:00') ENGINE = InnoDB,
 PARTITION `p14` VALUES LESS THAN ('2026-04-15 00:00:00') ENGINE = InnoDB,
 PARTITION `p15` VALUES LESS THAN ('2026-04-16 00:00:00') ENGINE = InnoDB,
 PARTITION `p16` VALUES LESS THAN ('2026-04-17 00:00:00') ENGINE = InnoDB,
 PARTITION `p17` VALUES LESS THAN ('2026-04-18 00:00:00') ENGINE = InnoDB,
 PARTITION `p18` VALUES LESS THAN ('2026-04-19 00:00:00') ENGINE = InnoDB,
 PARTITION `p19` VALUES LESS THAN ('2026-04-20 00:00:00') ENGINE = InnoDB,
 PARTITION `p20` VALUES LESS THAN ('2026-04-21 00:00:00') ENGINE = InnoDB,
 PARTITION `p21` VALUES LESS THAN ('2026-04-22 00:00:00') ENGINE = InnoDB,
 PARTITION `p22` VALUES LESS THAN ('2026-04-23 00:00:00') ENGINE = InnoDB,
 PARTITION `p23` VALUES LESS THAN ('2026-04-24 00:00:00') ENGINE = InnoDB,
 PARTITION `p24` VALUES LESS THAN ('2026-04-25 00:00:00') ENGINE = InnoDB,
 PARTITION `p25` VALUES LESS THAN ('2026-04-26 00:00:00') ENGINE = InnoDB,
 PARTITION `p26` VALUES LESS THAN ('2026-04-27 00:00:00') ENGINE = InnoDB,
 PARTITION `p27` VALUES LESS THAN ('2026-04-28 00:00:00') ENGINE = InnoDB,
 PARTITION `p28` VALUES LESS THAN ('2026-04-29 00:00:00') ENGINE = InnoDB,
 PARTITION `p29` VALUES LESS THAN ('2026-04-30 00:00:00') ENGINE = InnoDB,
 PARTITION `p30` VALUES LESS THAN ('2026-05-01 00:00:00') ENGINE = InnoDB,
 PARTITION `p31` VALUES LESS THAN ('2026-05-02 00:00:00') ENGINE = InnoDB,
 PARTITION `p32` VALUES LESS THAN ('2026-05-03 00:00:00') ENGINE = InnoDB,
 PARTITION `p33` VALUES LESS THAN ('2026-05-04 00:00:00') ENGINE = InnoDB,
 PARTITION `p34` VALUES LESS THAN ('2026-05-05 00:00:00') ENGINE = InnoDB,
 PARTITION `p35` VALUES LESS THAN ('2026-05-06 00:00:00') ENGINE = InnoDB,
 PARTITION `p36` VALUES LESS THAN ('2026-05-07 00:00:00') ENGINE = InnoDB)
select partition_name, partition_method, partition_expression, partition_description, table_rows from information_schema.partitions where table_name='t1';
partition_name	partition_method	partition_expression	partition_description	table_rows
p0	RANGE COLUMNS	`c`	'2026-04-01'	0
p1	RANGE COLUMNS	`c`	'2026-04-02 00:00:00'	0
p2	RANGE COLUMNS	`c`	'2026-04-03 00:00:00'	0
p3	RANGE COLUMNS	`c`	'2026-04-04 00:00:00'	0
p4	RANGE COLUMNS	`c`	'2026-04-05 00:00:00'	0
p5	RANGE COLUMNS	`c`	'2026-04-06 00:00:00'	0
p6	RANGE COLUMNS	`c`	'2026-04-07 00:00:00'	0
p7	RANGE COLUMNS	`c`	'2026-04-08 00:00:00'	0
p8	RANGE COLUMNS	`c`	'2026-04-09 00:00:00'	0
p9	RANGE COLUMNS	`c`	'2026-04-10 00:00:00'	0
p10	RANGE COLUMNS	`c`	'2026-04-11 00:00:00'	0
p11	RANGE COLUMNS	`c`	'2026-04-12 00:00:00'	0
p12	RANGE COLUMNS	`c`	'2026-04-13 00:00:00'	0
p13	RANGE COLUMNS	`c`	'2026-04-14 00:00:00'	0
p14	RANGE COLUMNS	`c`	'2026-04-15 00:00:00'	0
p15	RANGE COLUMNS	`c`	'2026-04-16 00:00:00'	0
p16	RANGE COLUMNS	`c`	'2026-04-17 00:00:00'	0
p17	RANGE COLUMNS	`c`	'2026-04-18 00:00:00'	0
p18	RANGE COLUMNS	`c`	'2026-04-19 00:00:00'	0
p19	RANGE COLUMNS	`c`	'2026-04-20 00:00:00'	0
p20	RANGE COLUMNS	`c`	'2026-04-21 00:00:00'	0
p21	RANGE COLUMNS	`c`	'2026-04-22 00:00:00'	0
p22	RANGE COLUMNS	`c`	'2026-04-23 00:00:00'	0
p23	RANGE COLUMNS	`c`	'2026-04-24 00:00:00'	0
p24	RANGE COLUMNS	`c`	'2026-04-25 00:00:00'	0
p25	RANGE COLUMNS	`c`	'2026-04-26 00:00:00'	0
p26	RANGE COLUMNS	`c`	'2026-04-27 00:00:00'	0
p27	RANGE COLUMNS	`c`	'2026-04-28 00:00:00'	0
p28	RANGE COLUMNS	`c`	'2026-04-29 00:00:00'	0
p29	RANGE COLUMNS	`c`	'2026-04-30 00:00:00'	0
p30	RANGE COLUMNS	`c`	'2026-05-01 00:00:00'	0
p31	RANGE COLUMNS	`c`	'2026-05-02 00:00:00'	0
p32	RANGE COLUMNS	`c`	'2026-05-03 00:00:00'	0
p33	RANGE COLUMNS	`c`	'2026-05-04 00:00:00'	0
p34	RANGE COLUMNS	`c`	'2026-05-05 00:00:00'	0
p35	RANGE COLUMNS	`c`	'2026-05-06 00:00:00'	0
p36	RANGE COLUMNS	`c`	'2026-05-07 00:00:00'	0
drop table t1;
# failures
create table t1 (c1 datetime, c2 datetime)
PARTITION BY RANGE COLUMNS (c1, c2)
INTERVAL 1 Day
(
PARTITION p0 VALUES LESS THAN ('2026-04-01', '2026-04-01')
);
ERROR HY000: Too many fields in 'range interval partition fields'
create table t1 (c datetime)
PARTITION BY LIST COLUMNS (c)
INTERVAL 1 Day
(
PARTITION p0 VALUES IN ('2026-04-01')
);
ERROR HY000: LIST partition type does not support INTERVAL
create table t1 (c int)
PARTITION BY RANGE COLUMNS (c)
INTERVAL 1 Day
(
PARTITION p0 VALUES LESS THAN (740072)
);
ERROR HY000: Field 'c' is of a not allowed type for this type of partitioning
# timestamp is not allowed in range column partitioning
create table t1 (c timestamp) engine=innodb
PARTITION BY RANGE COLUMNS (c)
INTERVAL 1 minute
(
PARTITION p0 VALUES LESS THAN ('2026-05-05')
);
ERROR HY000: Field 'c' is of a not allowed type for this type of partitioning
# year is not allowed in range column partitioning
create table t1 (c year) engine=innodb
PARTITION BY RANGE COLUMNS (c)
INTERVAL 1 minute
(
PARTITION p0 VALUES LESS THAN ('2025')
);
ERROR HY000: Field 'c' is of a not allowed type for this type of partitioning
# interval less than a day for date column
create table t1 (c date) engine=innodb
PARTITION BY RANGE COLUMNS (c)
INTERVAL 23.59 HOUR_MINUTE
(
PARTITION p0 VALUES LESS THAN ('2026-04-20')
);
ERROR HY000: RANGE COLUMN partition by a DATE with INTERVAL smaller than date
